video_id,author,comment,like_count,date,topic,year,normalization,tokenizing,stopword,stemming,category
e0SHDMs4bDk,@ikhwanefendi9470,pipet itu kalau banjir di bawa semua oleh air selang drip paling aman ditaruh dibawah mulsa dan dilubangi pakai mata kail hemat biaya,1,2022-09-26T01:20:23Z,irigasi,2022,pipet itu kalau banjir di bawa semua oleh air selang drip paling aman ditaruh dibawah mulsa dan dilubangi pakai mata kail hemat biaya,"pipet, itu, kalau, banjir, di, bawa, semua, oleh, air, selang, drip, paling, aman, ditaruh, dibawah, mulsa, dan, dilubangi, pakai, mata, kail, hemat, biaya","pipet, banjir, bawa, air, selang, drip, aman, ditaruh, dibawah, mulsa, dilubangi, pakai, mata, kail, hemat, biaya","pipet, banjir, bawa, air, selang, drip, aman, taruh, bawah, mulsa, lubang, pakai, mata, kail, hemat, biaya","biaya infrastruktur irigasi, efisiensi air irigasi, keandalan sistem irigasi, teknologi irigasi modern"
e0SHDMs4bDk,@sobat_sobat,mas selang pipet yang mancap di selang drif gak bocor rembes mas,0,2022-07-15T01:05:56Z,irigasi,2022,mas selang pipet yang mancap di selang drif gak bocor rembes mas,"mas, selang, pipet, yang, mancap, di, selang, drif, gak, bocor, rembes, mas","mas, selang, pipet, mancap, selang, drif, gak, bocor, rembes, mas","mas, selang, pipet, mancap, selang, drif, gak, bocor, rembes, mas",keandalan sistem irigasi
_99fDKfRq50,@Abdusbengkel,saran saya buat teman sebelum beli alat ini mendingan pake kain bekas baju di sobek sobek sesuai kebutuhan potong bagian atas botol untuk mempermudah pengisian air gunakan kain panjang menyentuh dasar bawah botol cara kerjanya air akan mengalir ke atas melalui kain tidak usah lubangi di bagian bawah karna kalian akan kesulitan menyetel keluarnya air kalo pake alat drip tetes seperti di video airi sering tersumbat lumut dan kotoran kecil kalian harus stel setiap hari sekian dan terimakasih semoga bermanfaat,15,2024-06-26T16:21:10Z,irigasi,2024,saran saya buat teman sebelum beli alat ini mendingan pake kain bekas baju di sobek sobek sesuai kebutuhan potong bagian atas botol untuk mempermudah pengisian air gunakan kain panjang menyentuh dasar bawah botol cara kerjanya air akan mengalir ke atas melalui kain tidak usah lubangi di bagian bawah karna kalian akan kesulitan menyetel keluarnya air kalo pake alat drip tetes seperti di video airi sering tersumbat lumut dan kotoran kecil kalian harus stel setiap hari sekian dan terimakasih semoga bermanfaat,"saran, saya, buat, teman, sebelum, beli, alat, ini, mendingan, pake, kain, bekas, baju, di, sobek, sobek, sesuai, kebutuhan, potong, bagian, atas, botol, untuk, mempermudah, pengisian, air, gunakan, kain, panjang, menyentuh, dasar, bawah, botol, cara, kerjanya, air, akan, mengalir, ke, atas, melalui, kain, tidak, usah, lubangi, di, bagian, bawah, karna, kalian, akan, kesulitan, menyetel, keluarnya, air, kalo, pake, alat, drip, tetes, seperti, di, video, airi, sering, tersumbat, lumut, dan, kotoran, kecil, kalian, harus, stel, setiap, hari, sekian, dan, terimakasih, semoga, bermanfaat","saran, teman, beli, alat, mendingan, pake, kain, bekas, baju, sobek, sobek, sesuai, kebutuhan, potong, botol, mempermudah, pengisian, air, kain, menyentuh, dasar, botol, kerjanya, air, mengalir, kain, lubangi, karna, kesulitan, menyetel, keluarnya, air, kalo, pake, alat, drip, tetes, video, airi, tersumbat, lumut, kotoran, stel, sekian, terimakasih, semoga, bermanfaat","saran, teman, beli, alat, mending, pake, kain, bekas, baju, sobek, sobek, sesuai, butuh, potong, botol, mudah, isi, air, kain, sentuh, dasar, botol, rja, air, alir, kain, lubang, karna, sulit, setel, luar, air, kalo, pake, alat, drip, tetes, video, air, sumbat, lumut, kotor, stel, sekian, terimakasih, moga, manfaat","efisiensi air irigasi, keandalan sistem irigasi, teknologi irigasi modern"
_99fDKfRq50,@saidatyani8916,pernah beli biji di coba atau yg berfungsi dan gak compatible ke semua mulut botol indo,1,2024-04-29T09:04:56Z,irigasi,2024,pernah beli biji di coba atau yg berfungsi dan gak compatible ke semua mulut botol indo,"pernah, beli, biji, di, coba, atau, yg, berfungsi, dan, gak, compatible, ke, semua, mulut, botol, indo","beli, biji, coba, yg, berfungsi, gak, compatible, mulut, botol, indo","beli, biji, coba, yg, fungsi, gak, compatible, mulut, botol, indo",keandalan sistem irigasi
_99fDKfRq50,@komangarta2482,apakah ada udara masuk untuk ruang kosong dalam botol takutnya botolnya malah keriput dan air malah macet,0,2023-08-15T06:05:23Z,irigasi,2023,apakah ada udara masuk untuk ruang kosong dalam botol takutnya botolnya malah keriput dan air malah macet,"apakah, ada, udara, masuk, untuk, ruang, kosong, dalam, botol, takutnya, botolnya, malah, keriput, dan, air, malah, macet","udara, masuk, ruang, kosong, botol, takutnya, botolnya, keriput, air, macet","udara, masuk, ruang, kosong, botol, takut, botol, riput, air, macet","efisiensi air irigasi, keandalan sistem irigasi"
_99fDKfRq50,@muhammadfaisalkhairullah-cn9xu,punya saya macet kak apa karna tak dibolongi diatas botolnya ya kak,1,2023-08-03T10:45:28Z,irigasi,2023,punya saya macet kak apa karna tak dibolongi diatas botolnya ya kak,"punya, saya, macet, kak, apa, karna, tak, dibolongi, diatas, botolnya, ya, kak","macet, kak, karna, dibolongi, diatas, botolnya, ya, kak","macet, kak, karna, bolong, atas, botol, ya, kak",keandalan sistem irigasi
