video_id,author,comment,like_count,date,topic,year,normalization,tokenizing,stopword,stemming,category
28Eo_Xm8LYg,@ahfadzmaarif1550,klo mau double menggunakan poc sama kimia harus beda hari ya pengaplikasiannya,0,2021-10-10T04:18:46Z,pemupukan,2021,klo mau double menggunakan poc sama kimia harus beda hari ya pengaplikasiannya,"klo, mau, double, menggunakan, poc, sama, kimia, harus, beda, hari, ya, pengaplikasiannya","klo, double, poc, kimia, beda, ya, pengaplikasiannya","klo, double, poc, kimia, beda, ya, aplikasi",konflik pupuk kimia organik
28Eo_Xm8LYg,@irfantarigan7642,kalau npk nya di kocor terpisah dengan em jarak waktu jam di tanah yg sama boleh kah pak,0,2021-10-07T05:17:04Z,pemupukan,2021,kalau npk nya di kocor terpisah dengan em jarak waktu jam di tanah yg sama boleh kah pak,"kalau, npk, nya, di, kocor, terpisah, dengan, em, jarak, waktu, jam, di, tanah, yg, sama, boleh, kah, pak","npk, nya, kocor, terpisah, em, jarak, jam, tanah, yg, kah","npk, , kocor, pisah, em, jarak, jam, tanah, yg, kah","dosis dan waktu pupuk, konflik pupuk kimia organik"
28Eo_Xm8LYg,@amriirawan6150,bg apa bisa kalou pupuk kimia di campur dengan pupuk kandang kotoran sapi yang sudah di permentasi,1,2021-10-06T16:31:38Z,pemupukan,2021,bg apa bisa kalou pupuk kimia di campur dengan pupuk kandang kotoran sapi yang sudah di permentasi,"bg, apa, bisa, kalou, pupuk, kimia, di, campur, dengan, pupuk, kandang, kotoran, sapi, yang, sudah, di, permentasi","bg, kalou, pupuk, kimia, campur, pupuk, kandang, kotoran, sapi, permentasi","bg, kalou, pupuk, kimia, campur, pupuk, kandang, kotor, sapi, tas","dosis dan waktu pupuk, konflik pupuk kimia organik"
28Eo_Xm8LYg,@DurianLampung,kalo pupuk kandang sama npk bisa digabung gak ya,0,2021-10-02T18:22:06Z,pemupukan,2021,kalo pupuk kandang sama npk bisa digabung gak ya,"kalo, pupuk, kandang, sama, npk, bisa, digabung, gak, ya","kalo, pupuk, kandang, npk, digabung, gak, ya","kalo, pupuk, kandang, npk, gabung, gak, ya","dosis dan waktu pupuk, konflik pupuk kimia organik"
28Eo_Xm8LYg,@hasyimcelebes8450,assalamualaikum pak izin bertanya jika bahan npk dari urin kelinci di campur kan dengan pgpr bisa pak dan jika bisa apakah hasilnya bagus,0,2021-09-30T15:05:54Z,pemupukan,2021,assalamualaikum pak izin bertanya jika bahan npk dari urin kelinci di campur kan dengan pgpr bisa pak dan jika bisa apakah hasilnya bagus,"assalamualaikum, pak, izin, bertanya, jika, bahan, npk, dari, urin, kelinci, di, campur, kan, dengan, pgpr, bisa, pak, dan, jika, bisa, apakah, hasilnya, bagus","assalamualaikum, izin, bahan, npk, urin, kelinci, campur, pgpr, hasilnya, bagus","assalamualaikum, izin, bahan, npk, urin, linci, campur, pgpr, hasil, bagus",konflik pupuk kimia organik
28Eo_Xm8LYg,@dhan8822,apakah yang akan terjadi jika pupuk kandang kotoran kabing di campurkan dengan npk plus ya pak,1,2021-09-29T22:25:12Z,pemupukan,2021,apakah yang akan terjadi jika pupuk kandang kotoran kabing di campurkan dengan npk plus ya pak,"apakah, yang, akan, terjadi, jika, pupuk, kandang, kotoran, kabing, di, campurkan, dengan, npk, plus, ya, pak","pupuk, kandang, kotoran, kabing, campurkan, npk, plus, ya","pupuk, kandang, kotor, kabing, campur, npk, plus, ya","dosis dan waktu pupuk, konflik pupuk kimia organik"
28Eo_Xm8LYg,@nonokirno5417,kmrin itu saya sudah pupuk sawit dengan npk phonska plus rencana saya mau saya tabur pupuk cair em yang saya tanyakan apa boleh saya beri em klu boleh jarak rentangnya berapa hari setelah pemupukan npk phonska plus tadi trimkasih mohon bimbingannya,0,2021-09-29T03:42:22Z,pemupukan,2021,kmrin itu saya sudah pupuk sawit dengan npk phonska plus rencana saya mau saya tabur pupuk cair em yang saya tanyakan apa boleh saya beri em klu boleh jarak rentangnya berapa hari setelah pemupukan npk phonska plus tadi trimkasih mohon bimbingannya,"kmrin, itu, saya, sudah, pupuk, sawit, dengan, npk, phonska, plus, rencana, saya, mau, saya, tabur, pupuk, cair, em, yang, saya, tanyakan, apa, boleh, saya, beri, em, klu, boleh, jarak, rentangnya, berapa, hari, setelah, pemupukan, npk, phonska, plus, tadi, trimkasih, mohon, bimbingannya","kmrin, pupuk, sawit, npk, phonska, plus, rencana, tabur, pupuk, cair, em, em, klu, jarak, rentangnya, pemupukan, npk, phonska, plus, trimkasih, mohon, bimbingannya","kmrin, pupuk, sawit, npk, phonska, plus, rencana, tabur, pupuk, cair, em, em, klu, jarak, rentang, pupu, npk, phonska, plus, trimkasih, mohon, bimbing","dosis dan waktu pupuk, konflik pupuk kimia organik"
28Eo_Xm8LYg,@alihsan1117,kalo trico mix npk,0,2021-09-27T14:15:49Z,pemupukan,2021,kalo trico mix npk,"kalo, trico, mix, npk","kalo, trico, mix, npk","kalo, trico, mix, npk",konflik pupuk kimia organik
28Eo_Xm8LYg,@TaufikTebbie,apakah boleh asam humat dicampur npk,0,2021-09-24T15:08:43Z,pemupukan,2021,apakah boleh asam humat dicampur npk,"apakah, boleh, asam, humat, dicampur, npk","asam, humat, dicampur, npk","asam, humat, campur, npk",konflik pupuk kimia organik
28Eo_Xm8LYg,@lintanlarasati8148,as pk klo trico derma dan asam humat bolehkah di cmpur dgn pupuk kimia,0,2021-09-20T18:26:50Z,pemupukan,2021,as pk klo trico derma dan asam humat bolehkah di cmpur dgn pupuk kimia,"as, pk, klo, trico, derma, dan, asam, humat, bolehkah, di, cmpur, dgn, pupuk, kimia","as, pk, klo, trico, derma, asam, humat, cmpur, dgn, pupuk, kimia","as, pk, klo, trico, derma, asam, humat, cmpur, dgn, pupuk, kimia","dosis dan waktu pupuk, konflik pupuk kimia organik"
28Eo_Xm8LYg,@divarahman0102,saya pake pupuk paten sama npk boleh,0,2021-09-20T11:03:00Z,pemupukan,2021,saya pake pupuk paten sama npk boleh,"saya, pake, pupuk, paten, sama, npk, boleh","pake, pupuk, paten, npk","pake, pupuk, paten, npk","dosis dan waktu pupuk, konflik pupuk kimia organik"
28Eo_Xm8LYg,@saktiaruzimunthe1502,pertanyaan saya jika menggunakan pupuk npk kapan kita bisa aplikasi poc ke tanaman atau sebaliknya jika menggunakan poc berapa lama waktu yg di butuhkan untuk mengaplikasikan npk terima kasih,5,2021-09-18T12:49:51Z,pemupukan,2021,pertanyaan saya jika menggunakan pupuk npk kapan kita bisa aplikasi poc ke tanaman atau sebaliknya jika menggunakan poc berapa lama waktu yg di butuhkan untuk mengaplikasikan npk terima kasih,"pertanyaan, saya, jika, menggunakan, pupuk, npk, kapan, kita, bisa, aplikasi, poc, ke, tanaman, atau, sebaliknya, jika, menggunakan, poc, berapa, lama, waktu, yg, di, butuhkan, untuk, mengaplikasikan, npk, terima, kasih","pupuk, npk, aplikasi, poc, tanaman, poc, yg, butuhkan, mengaplikasikan, npk, terima, kasih","pupuk, npk, aplikasi, poc, tanam, poc, yg, butuh, aplikasi, npk, terima, kasih","dosis dan waktu pupuk, konflik pupuk kimia organik"
28Eo_Xm8LYg,@edywibowo7961,duh sy baru saja buat media tanam menggunakan em untuk fermentasi lalu saya campurkan npk sebagai bahan pupuk dasar itu nasib nya gmn yah pak proses fermentasi nya nanti,0,2021-09-17T16:55:31Z,pemupukan,2021,duh sy baru saja buat media tanam menggunakan em untuk fermentasi lalu saya campurkan npk sebagai bahan pupuk dasar itu nasib nya gmn yah pak proses fermentasi nya nanti,"duh, sy, baru, saja, buat, media, tanam, menggunakan, em, untuk, fermentasi, lalu, saya, campurkan, npk, sebagai, bahan, pupuk, dasar, itu, nasib, nya, gmn, yah, pak, proses, fermentasi, nya, nanti","duh, sy, media, tanam, em, fermentasi, campurkan, npk, bahan, pupuk, dasar, nasib, nya, gmn, yah, proses, fermentasi, nya","duh, sy, media, tanam, em, fermentasi, campur, npk, bahan, pupuk, dasar, nasib, , gmn, yah, proses, fermentasi, ","dosis dan waktu pupuk, konflik pupuk kimia organik"
28Eo_Xm8LYg,@adriankhuana3520,hallo pak saya ingin bertanya bakteri di em apakah sudah aktif dengan campuran molase saat di campur dengan npk kimia aplikasi asam amino dr ikan dan em molase setelah minggu bisa di campur dengan npk kimia apakah hasil npk kimia yang di fementasi lebih baik dr npk organik,0,2021-09-17T12:21:45Z,pemupukan,2021,hallo pak saya ingin bertanya bakteri di em apakah sudah aktif dengan campuran molase saat di campur dengan npk kimia aplikasi asam amino dr ikan dan em molase setelah minggu bisa di campur dengan npk kimia apakah hasil npk kimia yang di fementasi lebih baik dr npk organik,"hallo, pak, saya, ingin, bertanya, bakteri, di, em, apakah, sudah, aktif, dengan, campuran, molase, saat, di, campur, dengan, npk, kimia, aplikasi, asam, amino, dr, ikan, dan, em, molase, setelah, minggu, bisa, di, campur, dengan, npk, kimia, apakah, hasil, npk, kimia, yang, di, fementasi, lebih, baik, dr, npk, organik","hallo, bakteri, em, aktif, campuran, molase, campur, npk, kimia, aplikasi, asam, amino, dr, ikan, em, molase, minggu, campur, npk, kimia, hasil, npk, kimia, fementasi, dr, npk, organik","hallo, bakteri, em, aktif, campur, molase, campur, npk, kimia, aplikasi, asam, amino, dr, ikan, em, molase, minggu, campur, npk, kimia, hasil, npk, kimia, fementasi, dr, npk, organik",konflik pupuk kimia organik
28Eo_Xm8LYg,@septayoga8214,mantaapp bang rizal saya penonton setia chanel anda mau tanya bang pgpr bisa gk dibuat fregmentasi kohe atau bahan organik lainnya mohon dijawab trimaksih,0,2021-09-17T07:47:52Z,pemupukan,2021,mantaapp bang rizal saya penonton setia chanel anda mau tanya bang pgpr bisa gk dibuat fregmentasi kohe atau bahan organik lainnya mohon dijawab trimaksih,"mantaapp, bang, rizal, saya, penonton, setia, chanel, anda, mau, tanya, bang, pgpr, bisa, gk, dibuat, fregmentasi, kohe, atau, bahan, organik, lainnya, mohon, dijawab, trimaksih","mantaapp, bang, rizal, penonton, setia, chanel, bang, pgpr, gk, fregmentasi, kohe, bahan, organik, mohon, trimaksih","mantaapp, bang, rizal, tonton, setia, chanel, bang, pgpr, gk, fregmentasi, kohe, bahan, organik, mohon, trimaksih",konflik pupuk kimia organik
28Eo_Xm8LYg,@irwansyahiwan5096,pak klao bedengan yg udh d kasih pupuk npk apa msh kita aplikasikan em lgi secara d siram,0,2021-09-16T12:36:57Z,pemupukan,2021,pak klao bedengan yg udh d kasih pupuk npk apa msh kita aplikasikan em lgi secara d siram,"pak, klao, bedengan, yg, udh, d, kasih, pupuk, npk, apa, msh, kita, aplikasikan, em, lgi, secara, d, siram","klao, bedengan, yg, udh, d, kasih, pupuk, npk, msh, aplikasikan, em, lgi, d, siram","klao, bedeng, yg, udh, d, kasih, pupuk, npk, msh, aplikasi, em, lgi, d, siram","dosis dan waktu pupuk, konflik pupuk kimia organik"
28Eo_Xm8LYg,@julihariyan3214,terimakasih ilmunya guru bisakah di ujicobakan bakteri di campur dengan pupuk urea,1,2021-09-14T22:59:51Z,pemupukan,2021,terimakasih ilmunya guru bisakah di ujicobakan bakteri di campur dengan pupuk urea,"terimakasih, ilmunya, guru, bisakah, di, ujicobakan, bakteri, di, campur, dengan, pupuk, urea","terimakasih, ilmunya, guru, ujicobakan, bakteri, campur, pupuk, urea","terimakasih, ilmu, guru, ujicobakan, bakteri, campur, pupuk, urea","dosis dan waktu pupuk, konflik pupuk kimia organik"
28Eo_Xm8LYg,@Abi_Mahyra,pak mhon maaf bertanya intinya jadi kalo pemupukan pilih salah satu mau kimia atau organik begitu ya boleh kah pemberian npk minggu sekali dan em hr sekali,1,2021-09-14T06:37:37Z,pemupukan,2021,pak mhon maaf bertanya intinya jadi kalo pemupukan pilih salah satu mau kimia atau organik begitu ya boleh kah pemberian npk minggu sekali dan em hr sekali,"pak, mhon, maaf, bertanya, intinya, jadi, kalo, pemupukan, pilih, salah, satu, mau, kimia, atau, organik, begitu, ya, boleh, kah, pemberian, npk, minggu, sekali, dan, em, hr, sekali","mhon, maaf, intinya, kalo, pemupukan, pilih, salah, kimia, organik, ya, kah, pemberian, npk, minggu, em, hr","mhon, maaf, inti, kalo, pupu, pilih, salah, kimia, organik, ya, kah, beri, npk, minggu, em, hr",konflik pupuk kimia organik
28Eo_Xm8LYg,@pasharentalsabang4978,intinya em vs npk grower atau pupuk kimia lainnya gk boleh dcampur ya mas mohon pencerahannya mas,0,2021-09-12T12:33:22Z,pemupukan,2021,intinya em vs npk grower atau pupuk kimia lainnya gk boleh dcampur ya mas mohon pencerahannya mas,"intinya, em, vs, npk, grower, atau, pupuk, kimia, lainnya, gk, boleh, dcampur, ya, mas, mohon, pencerahannya, mas","intinya, em, vs, npk, grower, pupuk, kimia, gk, dcampur, ya, mas, mohon, pencerahannya, mas","inti, em, vs, npk, grower, pupuk, kimia, gk, dcampur, ya, mas, mohon, cerah, mas","dosis dan waktu pupuk, konflik pupuk kimia organik"
28Eo_Xm8LYg,@irhammahdi186,pak bolehkah em dicampur dg pupuk kimia utk kocor misalkan ataukah tdk ada manfaatnya,0,2021-09-11T11:36:21Z,pemupukan,2021,pak bolehkah em dicampur dg pupuk kimia utk kocor misalkan ataukah tdk ada manfaatnya,"pak, bolehkah, em, dicampur, dg, pupuk, kimia, utk, kocor, misalkan, ataukah, tdk, ada, manfaatnya","em, dicampur, dg, pupuk, kimia, utk, kocor, tdk, manfaatnya","em, campur, dg, pupuk, kimia, utk, kocor, tdk, manfaat","dosis dan waktu pupuk, konflik pupuk kimia organik"
28Eo_Xm8LYg,@agusjolor8279,mas boleh gak minta tolong diperiksa di mikroskop untuk pencampuran kohe kambing sak direndam dalam drum liter terus dicampurkan npk mutiara apakah pencampuran npk tersebut malah memperbaiki unsur pupuk atau malah sebaliknya malah membunuh bakteri baik karena saya mendapat saran dari sesama petani jagung dia bilang sudah mempraktekkan dan berhasil baik katanya,0,2021-09-09T09:43:05Z,pemupukan,2021,mas boleh gak minta tolong diperiksa di mikroskop untuk pencampuran kohe kambing sak direndam dalam drum liter terus dicampurkan npk mutiara apakah pencampuran npk tersebut malah memperbaiki unsur pupuk atau malah sebaliknya malah membunuh bakteri baik karena saya mendapat saran dari sesama petani jagung dia bilang sudah mempraktekkan dan berhasil baik katanya,"mas, boleh, gak, minta, tolong, diperiksa, di, mikroskop, untuk, pencampuran, kohe, kambing, sak, direndam, dalam, drum, liter, terus, dicampurkan, npk, mutiara, apakah, pencampuran, npk, tersebut, malah, memperbaiki, unsur, pupuk, atau, malah, sebaliknya, malah, membunuh, bakteri, baik, karena, saya, mendapat, saran, dari, sesama, petani, jagung, dia, bilang, sudah, mempraktekkan, dan, berhasil, baik, katanya","mas, gak, tolong, diperiksa, mikroskop, pencampuran, kohe, kambing, sak, direndam, drum, liter, dicampurkan, npk, mutiara, pencampuran, npk, memperbaiki, unsur, pupuk, membunuh, bakteri, saran, petani, jagung, bilang, mempraktekkan, berhasil","mas, gak, tolong, periksa, mikroskop, campur, kohe, kambing, sak, rendam, drum, liter, campur, npk, mutiara, campur, npk, baik, unsur, pupuk, bunuh, bakteri, saran, tani, jagung, bilang, praktek, hasil","dosis dan waktu pupuk, konflik pupuk kimia organik"
28Eo_Xm8LYg,@kanzieyatman2412,kita harus buat perlakuan khusus dulu bakteri harus dapat di adaptasikan pada kondisi larutan telah tercampur pupuk kimia barulah bisa kalau jumlah larutan anda terlampau dikit maka malah membunuh bakterinya,1,2021-09-08T06:45:22Z,pemupukan,2021,kita harus buat perlakuan khusus dulu bakteri harus dapat di adaptasikan pada kondisi larutan telah tercampur pupuk kimia barulah bisa kalau jumlah larutan anda terlampau dikit maka malah membunuh bakterinya,"kita, harus, buat, perlakuan, khusus, dulu, bakteri, harus, dapat, di, adaptasikan, pada, kondisi, larutan, telah, tercampur, pupuk, kimia, barulah, bisa, kalau, jumlah, larutan, anda, terlampau, dikit, maka, malah, membunuh, bakterinya","perlakuan, khusus, bakteri, adaptasikan, kondisi, larutan, tercampur, pupuk, kimia, barulah, larutan, terlampau, dikit, membunuh, bakterinya","laku, khusus, bakteri, adaptasi, kondisi, larut, campur, pupuk, kimia, baru, larut, lampau, kit, bunuh, bakteri","dosis dan waktu pupuk, konflik pupuk kimia organik"
28Eo_Xm8LYg,@Hasifa-q9q,kalau misalnya kita kasih pagi hari poc dan sorenya kita kasih pupuk npk gimana apa bisa,0,2021-09-06T12:40:41Z,pemupukan,2021,kalau misalnya kita kasih pagi hari poc dan sorenya kita kasih pupuk npk gimana apa bisa,"kalau, misalnya, kita, kasih, pagi, hari, poc, dan, sorenya, kita, kasih, pupuk, npk, gimana, apa, bisa","kasih, pagi, poc, sorenya, kasih, pupuk, npk, gimana","kasih, pagi, poc, sore, kasih, pupuk, npk, gimana","dosis dan waktu pupuk, konflik pupuk kimia organik"
28Eo_Xm8LYg,@andyboyan1837,klo pengaplikasian gk bareng apa boleh om misal yg poc dlu minggu kemudian yg kimia,0,2021-09-04T11:00:06Z,pemupukan,2021,klo pengaplikasian gk bareng apa boleh om misal yg poc dlu minggu kemudian yg kimia,"klo, pengaplikasian, gk, bareng, apa, boleh, om, misal, yg, poc, dlu, minggu, kemudian, yg, kimia","klo, pengaplikasian, gk, bareng, om, yg, poc, dlu, minggu, yg, kimia","klo, aplikasi, gk, bareng, om, yg, poc, dlu, minggu, yg, kimia",konflik pupuk kimia organik
28Eo_Xm8LYg,@koperasipermataniindonesia7915,pupuk k sm bersifat sl mengandung bahan bio kimia organik cair dan bisa di campur dengan npkpupuk k sm ini pun mengandung pestisida alami sehingga mengurangi pencemaran lingkungan karena tema dari pupuk k sm adalah bertani tanpa racun salam super buat semua petani indonesia dari kami koprasi ksm lampung,9,2021-09-03T16:22:23Z,pemupukan,2021,pupuk k sm bersifat sl mengandung bahan bio kimia organik cair dan bisa di campur dengan npkpupuk k sm ini pun mengandung pestisida alami sehingga mengurangi pencemaran lingkungan karena tema dari pupuk k sm adalah bertani tanpa racun salam super buat semua petani indonesia dari kami koprasi ksm lampung,"pupuk, k, sm, bersifat, sl, mengandung, bahan, bio, kimia, organik, cair, dan, bisa, di, campur, dengan, npkpupuk, k, sm, ini, pun, mengandung, pestisida, alami, sehingga, mengurangi, pencemaran, lingkungan, karena, tema, dari, pupuk, k, sm, adalah, bertani, tanpa, racun, salam, super, buat, semua, petani, indonesia, dari, kami, koprasi, ksm, lampung","pupuk, k, sm, bersifat, sl, mengandung, bahan, bio, kimia, organik, cair, campur, npkpupuk, k, sm, mengandung, pestisida, alami, mengurangi, pencemaran, lingkungan, tema, pupuk, k, sm, bertani, racun, salam, super, petani, indonesia, koprasi, ksm, lampung","pupuk, k, sm, sifat, sl, andung, bahan, bio, kimia, organik, cair, campur, npkpupuk, k, sm, andung, pestisida, alami, urangi, cemar, lingkung, tema, pupuk, k, sm, tan, racun, salam, super, tani, indonesia, koprasi, ksm, lampung","dosis dan waktu pupuk, konflik pupuk kimia organik"
28Eo_Xm8LYg,@aniyulekha4379,assalamu alaikum pak ketika kita fermentasi pupuk kandang dengan em apakah biji bijian gulma didalamnya ikut mati terimaksih,0,2021-09-03T14:16:24Z,pemupukan,2021,assalamu alaikum pak ketika kita fermentasi pupuk kandang dengan em apakah biji bijian gulma didalamnya ikut mati terimaksih,"assalamu, alaikum, pak, ketika, kita, fermentasi, pupuk, kandang, dengan, em, apakah, biji, bijian, gulma, didalamnya, ikut, mati, terimaksih","assalamu, alaikum, fermentasi, pupuk, kandang, em, biji, bijian, gulma, didalamnya, mati, terimaksih","assalamu, alaikum, fermentasi, pupuk, kandang, em, biji, biji, gulma, dalam, mati, terimaksih","dampak pupuk ke tanaman, dosis dan waktu pupuk, konflik pupuk kimia organik"
28Eo_Xm8LYg,@iscofernando9969,pak jika poc nasa di campur pupuk kimia boleh egak,0,2021-09-03T07:16:28Z,pemupukan,2021,pak jika poc nasa di campur pupuk kimia boleh egak,"pak, jika, poc, nasa, di, campur, pupuk, kimia, boleh, egak","poc, nasa, campur, pupuk, kimia, egak","poc, nasa, campur, pupuk, kimia, egak","dosis dan waktu pupuk, konflik pupuk kimia organik"
28Eo_Xm8LYg,@togaleonardo8697,kenepa m bisa dicampur dengan npk,0,2021-08-30T12:10:56Z,pemupukan,2021,kenepa m bisa dicampur dengan npk,"kenepa, m, bisa, dicampur, dengan, npk","kenepa, m, dicampur, npk","nepa, m, campur, npk",konflik pupuk kimia organik
28Eo_Xm8LYg,@Ainayya184,kalo rotasi pupuk kima dengan poc boleh ga pak misalkan minggu ini menggunakan pupuk kimia kemudian minggu berikutnya poc mohon penjelasannya pak,0,2021-08-24T02:59:50Z,pemupukan,2021,kalo rotasi pupuk kima dengan poc boleh ga pak misalkan minggu ini menggunakan pupuk kimia kemudian minggu berikutnya poc mohon penjelasannya pak,"kalo, rotasi, pupuk, kima, dengan, poc, boleh, ga, pak, misalkan, minggu, ini, menggunakan, pupuk, kimia, kemudian, minggu, berikutnya, poc, mohon, penjelasannya, pak","kalo, rotasi, pupuk, kima, poc, ga, minggu, pupuk, kimia, minggu, poc, mohon, penjelasannya","kalo, rotasi, pupuk, kima, poc, ga, minggu, pupuk, kimia, minggu, poc, mohon, jelas","dosis dan waktu pupuk, konflik pupuk kimia organik"
28Eo_Xm8LYg,@syahrialazmi8541,pak kira efektif gak ya klu kita ppk dgn npk cair,0,2021-08-23T17:40:08Z,pemupukan,2021,pak kira efektif gak ya klu kita ppk dgn npk cair,"pak, kira, efektif, gak, ya, klu, kita, ppk, dgn, npk, cair","efektif, gak, ya, klu, ppk, dgn, npk, cair","efektif, gak, ya, klu, ppk, dgn, npk, cair",konflik pupuk kimia organik
28Eo_Xm8LYg,@supardisyamra2652,pak saya baru saja menabur npk di bedengan dan rencana sebelum tutup mulsa sy mau siram dengan permentasi em bolehkah pak atau malah sia sia em nya,0,2021-08-22T10:59:25Z,pemupukan,2021,pak saya baru saja menabur npk di bedengan dan rencana sebelum tutup mulsa sy mau siram dengan permentasi em bolehkah pak atau malah sia sia em nya,"pak, saya, baru, saja, menabur, npk, di, bedengan, dan, rencana, sebelum, tutup, mulsa, sy, mau, siram, dengan, permentasi, em, bolehkah, pak, atau, malah, sia, sia, em, nya","menabur, npk, bedengan, rencana, tutup, mulsa, sy, siram, permentasi, em, sia, sia, em, nya","tabur, npk, bedeng, rencana, tutup, mulsa, sy, siram, tas, em, sia, sia, em, ",konflik pupuk kimia organik
28Eo_Xm8LYg,@detris7985,pak apakah nafos guano termasuk organik atau kimia,0,2021-08-22T09:45:11Z,pemupukan,2021,pak apakah nafos guano termasuk organik atau kimia,"pak, apakah, nafos, guano, termasuk, organik, atau, kimia","nafos, guano, organik, kimia","nafos, guano, organik, kimia",konflik pupuk kimia organik
28Eo_Xm8LYg,@giepawewang5887,kalo misalnya kita pake pupuk kimia trus dua minggu kemudian kita lakukan pemupulan pake poc gmn pak,0,2021-08-20T08:30:40Z,pemupukan,2021,kalo misalnya kita pake pupuk kimia trus dua minggu kemudian kita lakukan pemupulan pake poc gmn pak,"kalo, misalnya, kita, pake, pupuk, kimia, trus, dua, minggu, kemudian, kita, lakukan, pemupulan, pake, poc, gmn, pak","kalo, pake, pupuk, kimia, trus, minggu, lakukan, pemupulan, pake, poc, gmn","kalo, pake, pupuk, kimia, trus, minggu, laku, pemupulan, pake, poc, gmn","dosis dan waktu pupuk, konflik pupuk kimia organik"
28Eo_Xm8LYg,@kangtanidusun9766,klo saya biasa pengaplikasian poc dan npk di kasih jarak seminggu tidak pernah mencampurkan poc dengak npk bagaimanakah hal ini apakah kurang bagus atau ada cara yang laen pengaplian poc dan npk yang lebih efisien,0,2021-08-20T04:23:33Z,pemupukan,2021,klo saya biasa pengaplikasian poc dan npk di kasih jarak seminggu tidak pernah mencampurkan poc dengak npk bagaimanakah hal ini apakah kurang bagus atau ada cara yang laen pengaplian poc dan npk yang lebih efisien,"klo, saya, biasa, pengaplikasian, poc, dan, npk, di, kasih, jarak, seminggu, tidak, pernah, mencampurkan, poc, dengak, npk, bagaimanakah, hal, ini, apakah, kurang, bagus, atau, ada, cara, yang, laen, pengaplian, poc, dan, npk, yang, lebih, efisien","klo, pengaplikasian, poc, npk, kasih, jarak, seminggu, mencampurkan, poc, dengak, npk, bagus, laen, pengaplian, poc, npk, efisien","klo, aplikasi, poc, npk, kasih, jarak, minggu, campur, poc, dengak, npk, bagus, laen, pengaplian, poc, npk, efisien","dosis dan waktu pupuk, efisiensi penggunaan pupuk, konflik pupuk kimia organik"
28Eo_Xm8LYg,@kebunkhawlah1027,saya pernah baca jurnal ilmiah bahwa bakteri penambat nitrogen di campur dengan urea dapat merombak urea menjadi nitrat dan nitrit inti dari video ini sebenarnya tergantung bakterinya kalau memang bakteri perombak nitrogen fosfat dll tidak akan mati kalau memang bakteri em game over ya tinggal pakai bakteri lain,0,2021-08-19T13:25:43Z,pemupukan,2021,saya pernah baca jurnal ilmiah bahwa bakteri penambat nitrogen di campur dengan urea dapat merombak urea menjadi nitrat dan nitrit inti dari video ini sebenarnya tergantung bakterinya kalau memang bakteri perombak nitrogen fosfat dll tidak akan mati kalau memang bakteri em game over ya tinggal pakai bakteri lain,"saya, pernah, baca, jurnal, ilmiah, bahwa, bakteri, penambat, nitrogen, di, campur, dengan, urea, dapat, merombak, urea, menjadi, nitrat, dan, nitrit, inti, dari, video, ini, sebenarnya, tergantung, bakterinya, kalau, memang, bakteri, perombak, nitrogen, fosfat, dll, tidak, akan, mati, kalau, memang, bakteri, em, game, over, ya, tinggal, pakai, bakteri, lain","baca, jurnal, ilmiah, bakteri, penambat, nitrogen, campur, urea, merombak, urea, nitrat, nitrit, inti, video, tergantung, bakterinya, bakteri, perombak, nitrogen, fosfat, dll, mati, bakteri, em, game, over, ya, tinggal, pakai, bakteri","baca, jurnal, ilmiah, bakteri, tambat, nitrogen, campur, urea, rombak, urea, nitrat, nitrit, inti, video, gantung, bakteri, bakteri, ombak, nitrogen, fosfat, dll, mati, bakteri, em, game, over, ya, tinggal, pakai, bakteri","dampak pupuk ke tanaman, konflik pupuk kimia organik"
28Eo_Xm8LYg,@abdulrohim5614,pengen tahu kalau nitrobacter azotobactet di campur sama npk urea dan amonium kira hasilnya bagaimana,1,2021-08-19T05:24:28Z,pemupukan,2021,pengen tahu kalau nitrobacter azotobactet di campur sama npk urea dan amonium kira hasilnya bagaimana,"pengen, tahu, kalau, nitrobacter, azotobactet, di, campur, sama, npk, urea, dan, amonium, kira, hasilnya, bagaimana","pengen, nitrobacter, azotobactet, campur, npk, urea, amonium, hasilnya","ken, nitrobacter, azotobactet, campur, npk, urea, amonium, hasil",konflik pupuk kimia organik
28Eo_Xm8LYg,@anakgila7100,permisi om izin bertanya mau nanam pakcoy dipolybag kalo pupuk cair abmix di campur dengan npk apakah boleh,0,2021-08-09T18:48:16Z,pemupukan,2021,permisi om izin bertanya mau nanam pakcoy dipolybag kalo pupuk cair abmix di campur dengan npk apakah boleh,"permisi, om, izin, bertanya, mau, nanam, pakcoy, dipolybag, kalo, pupuk, cair, abmix, di, campur, dengan, npk, apakah, boleh","permisi, om, izin, nanam, pakcoy, dipolybag, kalo, pupuk, cair, abmix, campur, npk","permisi, om, izin, nanam, pakcoy, polybag, kalo, pupuk, cair, abmix, campur, npk","dosis dan waktu pupuk, konflik pupuk kimia organik"
