video_id,author,comment,like_count,date,topic,year,normalization,tokenizing,stopword,stemming,category
-YlHpqcgOow,@arifinpangganglor6912,usia hst asam amino sendok ultradap sendok air liter disemprot secara basah jangan kabut usia hst npk gram per liter air kalau liter gram di kocor per tanaman ml usia hst asam amino sendok ultradap sendok magnesium sulfat sendok di semprot usia hst npk gram per liter jika liter berarti gram npk kocor usia sama perlakuannya seperti usia hst usia hst npk gram per liter air kalau liter berarti gram npk katalis pembenah tanah satu setengah liter di kocor masuk di bulan kedua cek ph tanah jika ph drop di bawah maka kasih kapur dolomit satu genggam per satu tanaman dan jika ph sekian maka boleh satu tanaman genggam kapur dolomit ga bakal mati amanusia hst kalian harus persiapan buah wadah wadah pertama di isi dengan asam amino sendok ultradap sendok magnesium sulfat sendok wadah kedua diisi dengan calnit sendok kno merah sendok setelah kedua di aduk rata kemudian di jadikan satu di dalam tangki liter di semprot usia hst npk kilo per liter air di kocor usia hst sama perlakuannya seperti usia hst usia hst sama perlakuannya seperti usia usia hst siapkan buah wadah wadah pertama di isi asam amino sendok ultradap sendok magnesium sulfat sendok wadah kedua kalsium nitrat sendok kno merah sendok lalu kedua di campur kedalam satu tangki liter semprot usia hst kocor npk kilo karate plus boroni kilo per liter air usia hst sama seperti usia hst usia hst npk kilo katalis pembenah tanah bulan ke biasa cek ulang ph tanah usia hst siapkan buah wadah wadah pertama di isi asam amino sendok ultradap sendok magnesium usulfat sendok wadah kedua calnit sendok kno putih sendok biasa di aduk dulu sampai rata kemudian di campur dalam satu tangki liter semprot usia hst npk kilo karate plus boroni kilo per liter kocor usia sama dengan usia usia sama dengan usia usia usia masih sama dengan usia usia hst npk grower kilo karate plus boroni kilo per liter air usia siapkan buah wadah wadah pertama di isi mkp sendok magnesium sulfat sendok sulfat opotas atau sop sendok bila tidak ada sulfat atau sop maka bisa di ganti dengan kcl kristal warna putih wadah kedua calnit sendok kno putih sendok seperti biasa di aduk keduanya sampai rata kemudian di jadikan satu dalam satu tangki semprot usia hst npk grower kilo karate plus boroni kilo katalis pembenah tanah per liter air usia hst perlakuannya sama dengan usia hst masuk bulan ke seperti biasa cek ph tanah usia npk grower kilo karate plus boroni kilo kcl merah kilo usia hst wadah pertama mkp sendok magnesium sulfat sendok sop kcl sendok vitoflek satu bungkus kecil wadah kedua calnit sendok kno putih sendok usia perlakuannya sama dengan usia usia hst mkp sendok mag s sendok sop kcl sendok vitoflek satu bungkus kecil per liter air,700,2024-10-29T10:04:28Z,pemupukan,2024,usia hst asam amino sendok ultradap sendok air liter disemprot secara basah jangan kabut usia hst npk gram per liter air kalau liter gram di kocor per tanaman ml usia hst asam amino sendok ultradap sendok magnesium sulfat sendok di semprot usia hst npk gram per liter jika liter berarti gram npk kocor usia sama perlakuannya seperti usia hst usia hst npk gram per liter air kalau liter berarti gram npk katalis pembenah tanah satu setengah liter di kocor masuk di bulan kedua cek ph tanah jika ph drop di bawah maka kasih kapur dolomit satu genggam per satu tanaman dan jika ph sekian maka boleh satu tanaman genggam kapur dolomit ga bakal mati amanusia hst kalian harus persiapan buah wadah wadah pertama di isi dengan asam amino sendok ultradap sendok magnesium sulfat sendok wadah kedua diisi dengan calnit sendok kno merah sendok setelah kedua di aduk rata kemudian di jadikan satu di dalam tangki liter di semprot usia hst npk kilo per liter air di kocor usia hst sama perlakuannya seperti usia hst usia hst sama perlakuannya seperti usia usia hst siapkan buah wadah wadah pertama di isi asam amino sendok ultradap sendok magnesium sulfat sendok wadah kedua kalsium nitrat sendok kno merah sendok lalu kedua di campur kedalam satu tangki liter semprot usia hst kocor npk kilo karate plus boroni kilo per liter air usia hst sama seperti usia hst usia hst npk kilo katalis pembenah tanah bulan ke biasa cek ulang ph tanah usia hst siapkan buah wadah wadah pertama di isi asam amino sendok ultradap sendok magnesium usulfat sendok wadah kedua calnit sendok kno putih sendok biasa di aduk dulu sampai rata kemudian di campur dalam satu tangki liter semprot usia hst npk kilo karate plus boroni kilo per liter kocor usia sama dengan usia usia sama dengan usia usia usia masih sama dengan usia usia hst npk grower kilo karate plus boroni kilo per liter air usia siapkan buah wadah wadah pertama di isi mkp sendok magnesium sulfat sendok sulfat opotas atau sop sendok bila tidak ada sulfat atau sop maka bisa di ganti dengan kcl kristal warna putih wadah kedua calnit sendok kno putih sendok seperti biasa di aduk keduanya sampai rata kemudian di jadikan satu dalam satu tangki semprot usia hst npk grower kilo karate plus boroni kilo katalis pembenah tanah per liter air usia hst perlakuannya sama dengan usia hst masuk bulan ke seperti biasa cek ph tanah usia npk grower kilo karate plus boroni kilo kcl merah kilo usia hst wadah pertama mkp sendok magnesium sulfat sendok sop kcl sendok vitoflek satu bungkus kecil wadah kedua calnit sendok kno putih sendok usia perlakuannya sama dengan usia usia hst mkp sendok mag s sendok sop kcl sendok vitoflek satu bungkus kecil per liter air,"usia, hst, asam, amino, sendok, ultradap, sendok, air, liter, disemprot, secara, basah, jangan, kabut, usia, hst, npk, gram, per, liter, air, kalau, liter, gram, di, kocor, per, tanaman, ml, usia, hst, asam, amino, sendok, ultradap, sendok, magnesium, sulfat, sendok, di, semprot, usia, hst, npk, gram, per, liter, jika, liter, berarti, gram, npk, kocor, usia, sama, perlakuannya, seperti, usia, hst, usia, hst, npk, gram, per, liter, air, kalau, liter, berarti, gram, npk, katalis, pembenah, tanah, satu, setengah, liter, di, kocor, masuk, di, bulan, kedua, cek, ph, tanah, jika, ph, drop, di, bawah, maka, kasih, kapur, dolomit, satu, genggam, per, satu, tanaman, dan, jika, ph, sekian, maka, boleh, satu, tanaman, genggam, kapur, dolomit, ga, bakal, mati, amanusia, hst, kalian, harus, persiapan, buah, wadah, wadah, pertama, di, isi, dengan, asam, amino, sendok, ultradap, sendok, magnesium, sulfat, sendok, wadah, kedua, diisi, dengan, calnit, sendok, kno, merah, sendok, setelah, kedua, di, aduk, rata, kemudian, di, jadikan, satu, di, dalam, tangki, liter, di, semprot, usia, hst, npk, kilo, per, liter, air, di, kocor, usia, hst, sama, perlakuannya, seperti, usia, hst, usia, hst, sama, perlakuannya, seperti, usia, usia, hst, siapkan, buah, wadah, wadah, pertama, di, isi, asam, amino, sendok, ultradap, sendok, magnesium, sulfat, sendok, wadah, kedua, kalsium, nitrat, sendok, kno, merah, sendok, lalu, kedua, di, campur, kedalam, satu, tangki, liter, semprot, usia, hst, kocor, npk, kilo, karate, plus, boroni, kilo, per, liter, air, usia, hst, sama, seperti, usia, hst, usia, hst, npk, kilo, katalis, pembenah, tanah, bulan, ke, biasa, cek, ulang, ph, tanah, usia, hst, siapkan, buah, wadah, wadah, pertama, di, isi, asam, amino, sendok, ultradap, sendok, magnesium, usulfat, sendok, wadah, kedua, calnit, sendok, kno, putih, sendok, biasa, di, aduk, dulu, sampai, rata, kemudian, di, campur, dalam, satu, tangki, liter, semprot, usia, hst, npk, kilo, karate, plus, boroni, kilo, per, liter, kocor, usia, sama, dengan, usia, usia, sama, dengan, usia, usia, usia, masih, sama, dengan, usia, usia, hst, npk, grower, kilo, karate, plus, boroni, kilo, per, liter, air, usia, siapkan, buah, wadah, wadah, pertama, di, isi, mkp, sendok, magnesium, sulfat, sendok, sulfat, opotas, atau, sop, sendok, bila, tidak, ada, sulfat, atau, sop, maka, bisa, di, ganti, dengan, kcl, kristal, warna, putih, wadah, kedua, calnit, sendok, kno, putih, sendok, seperti, biasa, di, aduk, keduanya, sampai, rata, kemudian, di, jadikan, satu, dalam, satu, tangki, semprot, usia, hst, npk, grower, kilo, karate, plus, boroni, kilo, katalis, pembenah, tanah, per, liter, air, usia, hst, perlakuannya, sama, dengan, usia, hst, masuk, bulan, ke, seperti, biasa, cek, ph, tanah, usia, npk, grower, kilo, karate, plus, boroni, kilo, kcl, merah, kilo, usia, hst, wadah, pertama, mkp, sendok, magnesium, sulfat, sendok, sop, kcl, sendok, vitoflek, satu, bungkus, kecil, wadah, kedua, calnit, sendok, kno, putih, sendok, usia, perlakuannya, sama, dengan, usia, usia, hst, mkp, sendok, mag, s, sendok, sop, kcl, sendok, vitoflek, satu, bungkus, kecil, per, liter, air","usia, hst, asam, amino, sendok, ultradap, sendok, air, liter, disemprot, basah, kabut, usia, hst, npk, gram, liter, air, liter, gram, kocor, tanaman, ml, usia, hst, asam, amino, sendok, ultradap, sendok, magnesium, sulfat, sendok, semprot, usia, hst, npk, gram, liter, liter, gram, npk, kocor, usia, perlakuannya, usia, hst, usia, hst, npk, gram, liter, air, liter, gram, npk, katalis, pembenah, tanah, liter, kocor, masuk, cek, ph, tanah, ph, drop, kasih, kapur, dolomit, genggam, tanaman, ph, sekian, tanaman, genggam, kapur, dolomit, ga, mati, amanusia, hst, persiapan, buah, wadah, wadah, isi, asam, amino, sendok, ultradap, sendok, magnesium, sulfat, sendok, wadah, diisi, calnit, sendok, kno, merah, sendok, aduk, jadikan, tangki, liter, semprot, usia, hst, npk, kilo, liter, air, kocor, usia, hst, perlakuannya, usia, hst, usia, hst, perlakuannya, usia, usia, hst, siapkan, buah, wadah, wadah, isi, asam, amino, sendok, ultradap, sendok, magnesium, sulfat, sendok, wadah, kalsium, nitrat, sendok, kno, merah, sendok, campur, kedalam, tangki, liter, semprot, usia, hst, kocor, npk, kilo, karate, plus, boroni, kilo, liter, air, usia, hst, usia, hst, usia, hst, npk, kilo, katalis, pembenah, tanah, cek, ulang, ph, tanah, usia, hst, siapkan, buah, wadah, wadah, isi, asam, amino, sendok, ultradap, sendok, magnesium, usulfat, sendok, wadah, calnit, sendok, kno, putih, sendok, aduk, campur, tangki, liter, semprot, usia, hst, npk, kilo, karate, plus, boroni, kilo, liter, kocor, usia, usia, usia, usia, usia, usia, usia, usia, hst, npk, grower, kilo, karate, plus, boroni, kilo, liter, air, usia, siapkan, buah, wadah, wadah, isi, mkp, sendok, magnesium, sulfat, sendok, sulfat, opotas, sop, sendok, sulfat, sop, ganti, kcl, kristal, warna, putih, wadah, calnit, sendok, kno, putih, sendok, aduk, jadikan, tangki, semprot, usia, hst, npk, grower, kilo, karate, plus, boroni, kilo, katalis, pembenah, tanah, liter, air, usia, hst, perlakuannya, usia, hst, masuk, cek, ph, tanah, usia, npk, grower, kilo, karate, plus, boroni, kilo, kcl, merah, kilo, usia, hst, wadah, mkp, sendok, magnesium, sulfat, sendok, sop, kcl, sendok, vitoflek, bungkus, wadah, calnit, sendok, kno, putih, sendok, usia, perlakuannya, usia, usia, hst, mkp, sendok, mag, s, sendok, sop, kcl, sendok, vitoflek, bungkus, liter, air","usia, hst, asam, amino, sendok, ultradap, sendok, air, liter, semprot, basah, kabut, usia, hst, npk, gram, liter, air, liter, gram, kocor, tanam, ml, usia, hst, asam, amino, sendok, ultradap, sendok, magnesium, sulfat, sendok, semprot, usia, hst, npk, gram, liter, liter, gram, npk, kocor, usia, laku, usia, hst, usia, hst, npk, gram, liter, air, liter, gram, npk, katalis, benah, tanah, liter, kocor, masuk, cek, ph, tanah, ph, drop, kasih, kapur, dolomit, genggam, tanam, ph, sekian, tanam, genggam, kapur, dolomit, ga, mati, amanusia, hst, siap, buah, wadah, wadah, isi, asam, amino, sendok, ultradap, sendok, magnesium, sulfat, sendok, wadah, isi, calnit, sendok, kno, merah, sendok, aduk, jadi, tangki, liter, semprot, usia, hst, npk, kilo, liter, air, kocor, usia, hst, laku, usia, hst, usia, hst, laku, usia, usia, hst, siap, buah, wadah, wadah, isi, asam, amino, sendok, ultradap, sendok, magnesium, sulfat, sendok, wadah, kalsium, nitrat, sendok, kno, merah, sendok, campur, dalam, tangki, liter, semprot, usia, hst, kocor, npk, kilo, karate, plus, boron, kilo, liter, air, usia, hst, usia, hst, usia, hst, npk, kilo, katalis, benah, tanah, cek, ulang, ph, tanah, usia, hst, siap, buah, wadah, wadah, isi, asam, amino, sendok, ultradap, sendok, magnesium, usulfat, sendok, wadah, calnit, sendok, kno, putih, sendok, aduk, campur, tangki, liter, semprot, usia, hst, npk, kilo, karate, plus, boron, kilo, liter, kocor, usia, usia, usia, usia, usia, usia, usia, usia, hst, npk, grower, kilo, karate, plus, boron, kilo, liter, air, usia, siap, buah, wadah, wadah, isi, mkp, sendok, magnesium, sulfat, sendok, sulfat, opotas, sop, sendok, sulfat, sop, ganti, kcl, kristal, warna, putih, wadah, calnit, sendok, kno, putih, sendok, aduk, jadi, tangki, semprot, usia, hst, npk, grower, kilo, karate, plus, boron, kilo, katalis, benah, tanah, liter, air, usia, hst, laku, usia, hst, masuk, cek, ph, tanah, usia, npk, grower, kilo, karate, plus, boron, kilo, kcl, merah, kilo, usia, hst, wadah, mkp, sendok, magnesium, sulfat, sendok, sop, kcl, sendok, vitoflek, bungkus, wadah, calnit, sendok, kno, putih, sendok, usia, laku, usia, usia, hst, mkp, sendok, mag, s, sendok, sop, kcl, sendok, vitoflek, bungkus, liter, air","dampak pupuk ke tanaman, konflik pupuk kimia organik"
-YlHpqcgOow,@khoirmaulana9928,pak brapa butir npk awal pemupukan yg bagus klo ditabur kan,0,2024-10-29T08:40:06Z,pemupukan,2024,pak brapa butir npk awal pemupukan yg bagus klo ditabur kan,"pak, brapa, butir, npk, awal, pemupukan, yg, bagus, klo, ditabur, kan","brapa, butir, npk, pemupukan, yg, bagus, klo, ditabur","brapa, butir, npk, pupu, yg, bagus, klo, tabur",konflik pupuk kimia organik
-YlHpqcgOow,@safrimanman315,kalau bisa full organik sopnya ombiar rama lingkungan,5,2024-10-29T05:45:14Z,pemupukan,2024,kalau bisa full organik sopnya ombiar rama lingkungan,"kalau, bisa, full, organik, sopnya, ombiar, rama, lingkungan","full, organik, sopnya, ombiar, rama, lingkungan","full, organik, sop, ombiar, rama, lingkung",konflik pupuk kimia organik
-YlHpqcgOow,@mohandjowo9019,kirain secara organik ternyata pake kimia mantab mantab,1,2024-10-29T05:33:38Z,pemupukan,2024,kirain secara organik ternyata pake kimia mantab mantab,"kirain, secara, organik, ternyata, pake, kimia, mantab, mantab","kirain, organik, pake, kimia, mantab, mantab","kirain, organik, pake, kimia, mantab, mantab",konflik pupuk kimia organik
-YlHpqcgOow,@bahruzaini5532,pengocorannya npk dicampur sama ambition atau fulka untuk memacu pertumbuhan kd papalah pa soalnya tanahnya kritis banar masam batagar kuning,1,2024-10-29T00:11:18Z,pemupukan,2024,pengocorannya npk dicampur sama ambition atau fulka untuk memacu pertumbuhan kd papalah pa soalnya tanahnya kritis banar masam batagar kuning,"pengocorannya, npk, dicampur, sama, ambition, atau, fulka, untuk, memacu, pertumbuhan, kd, papalah, pa, soalnya, tanahnya, kritis, banar, masam, batagar, kuning","pengocorannya, npk, dicampur, ambition, fulka, memacu, pertumbuhan, kd, papalah, pa, tanahnya, kritis, banar, masam, batagar, kuning","kocor, npk, campur, ambition, fulka, pacu, tumbuh, kd, papa, pa, tanah, kritis, banar, masam, batagar, kuning","dampak pupuk ke tanaman, konflik pupuk kimia organik"
-YlHpqcgOow,@khanzazen2376,pak bunga cabe saya rontok usia hst sudah pe di kocor x sekarang pake npk growe nitra bor mkp minta masukan pak plissss i love you bpk,0,2024-10-28T20:18:41Z,pemupukan,2024,pak bunga cabe saya rontok usia hst sudah pe di kocor x sekarang pake npk growe nitra bor mkp minta masukan pak plissss i love you bpk,"pak, bunga, cabe, saya, rontok, usia, hst, sudah, pe, di, kocor, x, sekarang, pake, npk, growe, nitra, bor, mkp, minta, masukan, pak, plissss, i, love, you, bpk","bunga, cabe, rontok, usia, hst, pe, kocor, x, pake, npk, growe, nitra, bor, mkp, masukan, plissss, i, love, you, bpk","bunga, cabe, rontok, usia, hst, pe, kocor, x, pake, npk, growe, nitra, bor, mkp, masuk, plissss, i, love, you, bpk",konflik pupuk kimia organik
-YlHpqcgOow,@radytcell,assalamualaikum mang mun mngocor tanaman npk gram polibag ky apa sedang ja kah ato kebnyakan,1,2024-10-28T18:25:29Z,pemupukan,2024,assalamualaikum mang mun mngocor tanaman npk gram polibag ky apa sedang ja kah ato kebnyakan,"assalamualaikum, mang, mun, mngocor, tanaman, npk, gram, polibag, ky, apa, sedang, ja, kah, ato, kebnyakan","assalamualaikum, mang, mun, mngocor, tanaman, npk, gram, polibag, ky, ja, kah, ato, kebnyakan","assalamualaikum, mang, mun, mngocor, tanam, npk, gram, polibag, ky, ja, kah, ato, bnyakan",konflik pupuk kimia organik
-YlHpqcgOow,@kebunyu,ribet amat pak cabe saya tak pernah saya tanam tiba tumbuh sendiri di bawah kandang kambing yg kosong bulanan dari sini saya mulai berpikir pupuk aneh orang yg lg jualan penting jika sudah masuk masa generatif cukup kasih kcl kalsium pupuk kandang kompos the best di masa generatif,0,2024-10-28T13:58:44Z,pemupukan,2024,ribet amat pak cabe saya tak pernah saya tanam tiba tumbuh sendiri di bawah kandang kambing yg kosong bulanan dari sini saya mulai berpikir pupuk aneh orang yg lg jualan penting jika sudah masuk masa generatif cukup kasih kcl kalsium pupuk kandang kompos the best di masa generatif,"ribet, amat, pak, cabe, saya, tak, pernah, saya, tanam, tiba, tumbuh, sendiri, di, bawah, kandang, kambing, yg, kosong, bulanan, dari, sini, saya, mulai, berpikir, pupuk, aneh, orang, yg, lg, jualan, penting, jika, sudah, masuk, masa, generatif, cukup, kasih, kcl, kalsium, pupuk, kandang, kompos, the, best, di, masa, generatif","ribet, cabe, tanam, tumbuh, kandang, kambing, yg, kosong, bulanan, berpikir, pupuk, aneh, orang, yg, lg, jualan, masuk, generatif, kasih, kcl, kalsium, pupuk, kandang, kompos, the, best, generatif","ribet, cabe, tanam, tumbuh, kandang, kambing, yg, kosong, bulan, pikir, pupuk, aneh, orang, yg, lg, jual, masuk, generatif, kasih, kcl, kalsium, pupuk, kandang, kompos, the, best, generatif","dampak pupuk ke tanaman, dosis dan waktu pupuk, konflik pupuk kimia organik"
-YlHpqcgOow,@bapakzamil,mantap tolong bikin vidio lebih banyak organik dari sitetis,2,2024-10-28T13:50:51Z,pemupukan,2024,mantap tolong bikin vidio lebih banyak organik dari sitetis,"mantap, tolong, bikin, vidio, lebih, banyak, organik, dari, sitetis","mantap, tolong, bikin, vidio, organik, sitetis","mantap, tolong, bikin, vidio, organik, sitetis",konflik pupuk kimia organik
-YlHpqcgOow,@liedien2928,pak kalau npk ngocornya klo sudah difermentasi pake em kira brapa ml ya,1,2024-10-28T13:33:59Z,pemupukan,2024,pak kalau npk ngocornya klo sudah difermentasi pake em kira brapa ml ya,"pak, kalau, npk, ngocornya, klo, sudah, difermentasi, pake, em, kira, brapa, ml, ya","npk, ngocornya, klo, difermentasi, pake, em, brapa, ml, ya","npk, ocor, klo, fermentasi, pake, em, brapa, ml, ya",konflik pupuk kimia organik
-YlHpqcgOow,@andiagoes666,kepengen juga sop full organik pak terima kasih atas ilmunya semoga menjadi amal jariah untuk bapak,19,2024-10-28T13:08:19Z,pemupukan,2024,kepengen juga sop full organik pak terima kasih atas ilmunya semoga menjadi amal jariah untuk bapak,"kepengen, juga, sop, full, organik, pak, terima, kasih, atas, ilmunya, semoga, menjadi, amal, jariah, untuk, bapak","kepengen, sop, full, organik, terima, kasih, ilmunya, semoga, amal, jariah","ken, sop, full, organik, terima, kasih, ilmu, moga, amal, jariah",konflik pupuk kimia organik
-YlHpqcgOow,@batman23-yf7iu,sop pemupukan organik pak,0,2024-10-28T12:10:38Z,pemupukan,2024,sop pemupukan organik pak,"sop, pemupukan, organik, pak","sop, pemupukan, organik","sop, pupu, organik",konflik pupuk kimia organik
-YlHpqcgOow,@UrayRullySiswadi,waalaikumus salam waramahtulah hibarokatu mantap betul bang pupuk kimia hanya tambahan nuterisi yg kurang di dalam tanah,0,2024-10-28T11:41:41Z,pemupukan,2024,waalaikumus salam waramahtulah hibarokatu mantap betul bang pupuk kimia hanya tambahan nuterisi yg kurang di dalam tanah,"waalaikumus, salam, waramahtulah, hibarokatu, mantap, betul, bang, pupuk, kimia, hanya, tambahan, nuterisi, yg, kurang, di, dalam, tanah","waalaikumus, salam, waramahtulah, hibarokatu, mantap, bang, pupuk, kimia, tambahan, nuterisi, yg, tanah","waalaikumus, salam, waramahtulah, hibarokatu, mantap, bang, pupuk, kimia, tambah, nuterisi, yg, tanah","dosis dan waktu pupuk, konflik pupuk kimia organik"
-YlHpqcgOow,@ayuningkhalfani9526,bogor menyimak spill yang versi full organik dong pak dari mulai semai hingga panenterima kasih semua ilmunya mohon izin mempraktekan dan mengamalkansemoga bapak sehat selalu,0,2024-10-28T11:24:24Z,pemupukan,2024,bogor menyimak spill yang versi full organik dong pak dari mulai semai hingga panenterima kasih semua ilmunya mohon izin mempraktekan dan mengamalkansemoga bapak sehat selalu,"bogor, menyimak, spill, yang, versi, full, organik, dong, pak, dari, mulai, semai, hingga, panenterima, kasih, semua, ilmunya, mohon, izin, mempraktekan, dan, mengamalkansemoga, bapak, sehat, selalu","bogor, menyimak, spill, versi, full, organik, semai, panenterima, kasih, ilmunya, mohon, izin, mempraktekan, mengamalkansemoga, sehat","bogor, simak, spill, versi, full, organik, semai, panenterima, kasih, ilmu, mohon, izin, praktek, amalkansemoga, sehat",konflik pupuk kimia organik
-YlHpqcgOow,@mdhbcr,ini ada ponska sma urea subsidi dibuat apa pak,0,2024-10-28T11:18:52Z,pemupukan,2024,ini ada ponska sma urea subsidi dibuat apa pak,"ini, ada, ponska, sma, urea, subsidi, dibuat, apa, pak","ponska, sma, urea, subsidi","ponska, sma, urea, subsidi",konflik pupuk kimia organik
-YlHpqcgOow,@PenyuluhPertanianLapangan,mohon baca catatan video ini yakinlah dengan hasil tidak akan mengkhianati usaha sop ini diberikan gratis tis tis jadi tinggal catat saja ya mudah mudahan usaha mencatatnya bisa berbuah keberhasilan sop ini adalah yang saya biasa terapkan di lahan pribadi dan saat ini diterapkan di lahan kantor yang keadaanya jauh lebih ekstrim dan tetap bisa subur batangnya besar besar untuk lahan dengan kesuburan yang baik maka dosis pupuk sesuai panduan ini maksimal nya saja ya pupuk mikro tidak kami beri saat vegetatif untuk menghemat biaya karena pada dasaran sudah lengkap full organik yang berisi full unsur mikro dan lagi juga asam amino juga ada mikronya pengendalian hpt tidak digabung jadi harinya beda ya dalam aplikasinya nanti bisa kombinasi antara insek fungi perekat maksimal campuran,197,2024-10-28T09:15:18Z,pemupukan,2024,mohon baca catatan video ini yakinlah dengan hasil tidak akan mengkhianati usaha sop ini diberikan gratis tis tis jadi tinggal catat saja ya mudah mudahan usaha mencatatnya bisa berbuah keberhasilan sop ini adalah yang saya biasa terapkan di lahan pribadi dan saat ini diterapkan di lahan kantor yang keadaanya jauh lebih ekstrim dan tetap bisa subur batangnya besar besar untuk lahan dengan kesuburan yang baik maka dosis pupuk sesuai panduan ini maksimal nya saja ya pupuk mikro tidak kami beri saat vegetatif untuk menghemat biaya karena pada dasaran sudah lengkap full organik yang berisi full unsur mikro dan lagi juga asam amino juga ada mikronya pengendalian hpt tidak digabung jadi harinya beda ya dalam aplikasinya nanti bisa kombinasi antara insek fungi perekat maksimal campuran,"mohon, baca, catatan, video, ini, yakinlah, dengan, hasil, tidak, akan, mengkhianati, usaha, sop, ini, diberikan, gratis, tis, tis, jadi, tinggal, catat, saja, ya, mudah, mudahan, usaha, mencatatnya, bisa, berbuah, keberhasilan, sop, ini, adalah, yang, saya, biasa, terapkan, di, lahan, pribadi, dan, saat, ini, diterapkan, di, lahan, kantor, yang, keadaanya, jauh, lebih, ekstrim, dan, tetap, bisa, subur, batangnya, besar, besar, untuk, lahan, dengan, kesuburan, yang, baik, maka, dosis, pupuk, sesuai, panduan, ini, maksimal, nya, saja, ya, pupuk, mikro, tidak, kami, beri, saat, vegetatif, untuk, menghemat, biaya, karena, pada, dasaran, sudah, lengkap, full, organik, yang, berisi, full, unsur, mikro, dan, lagi, juga, asam, amino, juga, ada, mikronya, pengendalian, hpt, tidak, digabung, jadi, harinya, beda, ya, dalam, aplikasinya, nanti, bisa, kombinasi, antara, insek, fungi, perekat, maksimal, campuran","mohon, baca, catatan, video, yakinlah, hasil, mengkhianati, usaha, sop, gratis, tis, tis, tinggal, catat, ya, mudah, mudahan, usaha, mencatatnya, berbuah, keberhasilan, sop, terapkan, lahan, pribadi, diterapkan, lahan, kantor, keadaanya, ekstrim, subur, batangnya, lahan, kesuburan, dosis, pupuk, sesuai, panduan, maksimal, nya, ya, pupuk, mikro, vegetatif, menghemat, biaya, dasaran, lengkap, full, organik, berisi, full, unsur, mikro, asam, amino, mikronya, pengendalian, hpt, digabung, harinya, beda, ya, aplikasinya, kombinasi, insek, fungi, perekat, maksimal, campuran","mohon, baca, catat, video, yakin, hasil, khianat, usaha, sop, gratis, tis, tis, tinggal, catat, ya, mudah, mudah, usaha, catat, buah, hasil, sop, terap, lahan, pribadi, terap, lahan, kantor, adaa, ekstrim, subur, batang, lahan, subur, dosis, pupuk, sesuai, pandu, maksimal, , ya, pupuk, mikro, vegetatif, hemat, biaya, dasar, lengkap, full, organik, isi, full, unsur, mikro, asam, amino, mikro, kendali, hpt, gabung, hari, beda, ya, aplikasi, kombinasi, insek, fungi, rekat, maksimal, campur","dampak pupuk ke tanaman, dosis dan waktu pupuk, efisiensi penggunaan pupuk, konflik pupuk kimia organik"
