video_id,author,comment,like_count,date,topic,year,normalization,tokenizing,stopword,stemming,category
UfbQxFXre5Q,@hasanprasojoprobolinggo5160,didaerah kami harga pupuk tgl juli sak isi kg sudah tembus juta dari sebelumnya harga rb kg pupuk npk grower,0,2022-07-02T19:26:28Z,pemupukan,2022,didaerah kami harga pupuk tgl juli sak isi kg sudah tembus juta dari sebelumnya harga rb kg pupuk npk grower,"didaerah, kami, harga, pupuk, tgl, juli, sak, isi, kg, sudah, tembus, juta, dari, sebelumnya, harga, rb, kg, pupuk, npk, grower","didaerah, harga, pupuk, tgl, juli, sak, isi, kg, tembus, juta, harga, rb, kg, pupuk, npk, grower","daerah, harga, pupuk, tgl, juli, sak, isi, kg, tembus, juta, harga, rb, kg, pupuk, npk, grower","dosis dan waktu pupuk, konflik pupuk kimia organik"
UfbQxFXre5Q,@askat8299,mantap sekali sekarang pupuk urea kg rb sedangkan gabah rb kuintal alhasil perberian pupuk urea utk sawah yg dulunya di beri kg sekarang cuma di beri kg adakah alternatif utk membuat pupuk urea sendiri,0,2022-05-21T11:27:29Z,pemupukan,2022,mantap sekali sekarang pupuk urea kg rb sedangkan gabah rb kuintal alhasil perberian pupuk urea utk sawah yg dulunya di beri kg sekarang cuma di beri kg adakah alternatif utk membuat pupuk urea sendiri,"mantap, sekali, sekarang, pupuk, urea, kg, rb, sedangkan, gabah, rb, kuintal, alhasil, perberian, pupuk, urea, utk, sawah, yg, dulunya, di, beri, kg, sekarang, cuma, di, beri, kg, adakah, alternatif, utk, membuat, pupuk, urea, sendiri","mantap, pupuk, urea, kg, rb, gabah, rb, kuintal, alhasil, perberian, pupuk, urea, utk, sawah, yg, dulunya, kg, kg, adakah, alternatif, utk, pupuk, urea","mantap, pupuk, urea, kg, rb, gabah, rb, kuintal, alhasil, beri, pupuk, urea, utk, sawah, yg, dulu, kg, kg, ada, alternatif, utk, pupuk, urea","dosis dan waktu pupuk, konflik pupuk kimia organik"
UfbQxFXre5Q,@suranto2789,di tempat saya npk udah di harga jt pak,0,2022-05-13T15:03:41Z,pemupukan,2022,di tempat saya npk udah di harga jt pak,"di, tempat, saya, npk, udah, di, harga, jt, pak","npk, udah, harga, jt","npk, udah, harga, jt",konflik pupuk kimia organik
UfbQxFXre5Q,@petanireceh1989,urea kg rb bos di t kami,0,2022-04-30T08:50:26Z,pemupukan,2022,urea kg rb bos di t kami,"urea, kg, rb, bos, di, t, kami","urea, kg, rb, bos, t","urea, kg, rb, bos, t",konflik pupuk kimia organik
UfbQxFXre5Q,@usmanmaulana5083,mau tanya pak kenapa di tempat saya kalau beli pupuk subsidi itu ada embel nya pupuk organik contoh saya beli pupuk phonska sak itu harus dipaksa beli pupuk organik sak juga apakah hal seperti ini aturan pemerintah atau memang agennya yang main terimakasih mohon dijawab,0,2022-02-15T02:51:09Z,pemupukan,2022,mau tanya pak kenapa di tempat saya kalau beli pupuk subsidi itu ada embel nya pupuk organik contoh saya beli pupuk phonska sak itu harus dipaksa beli pupuk organik sak juga apakah hal seperti ini aturan pemerintah atau memang agennya yang main terimakasih mohon dijawab,"mau, tanya, pak, kenapa, di, tempat, saya, kalau, beli, pupuk, subsidi, itu, ada, embel, nya, pupuk, organik, contoh, saya, beli, pupuk, phonska, sak, itu, harus, dipaksa, beli, pupuk, organik, sak, juga, apakah, hal, seperti, ini, aturan, pemerintah, atau, memang, agennya, yang, main, terimakasih, mohon, dijawab","beli, pupuk, subsidi, embel, nya, pupuk, organik, contoh, beli, pupuk, phonska, sak, dipaksa, beli, pupuk, organik, sak, aturan, pemerintah, agennya, main, terimakasih, mohon","beli, pupuk, subsidi, embel, , pupuk, organik, contoh, beli, pupuk, phonska, sak, paksa, beli, pupuk, organik, sak, atur, perintah, agen, main, terimakasih, mohon","dosis dan waktu pupuk, efisiensi penggunaan pupuk, konflik pupuk kimia organik"
UfbQxFXre5Q,@Sumarno-ry5gg,maaf pak mau nanya apakah pupuk npk cair epektip jika carapenggunaanya disemprot kan ke tanaman keras karet mohon info nya,0,2022-02-08T10:47:34Z,pemupukan,2022,maaf pak mau nanya apakah pupuk npk cair epektip jika carapenggunaanya disemprot kan ke tanaman keras karet mohon info nya,"maaf, pak, mau, nanya, apakah, pupuk, npk, cair, epektip, jika, carapenggunaanya, disemprot, kan, ke, tanaman, keras, karet, mohon, info, nya","maaf, nanya, pupuk, npk, cair, epektip, carapenggunaanya, disemprot, tanaman, keras, karet, mohon, info, nya","maaf, na, pupuk, npk, cair, epektip, carapenggunaa, semprot, tanam, ras, karet, mohon, info, ","dosis dan waktu pupuk, konflik pupuk kimia organik"
UfbQxFXre5Q,@kimyojong.896,sebenarny ini cm ulah oligarki pada awalnya memang krna pandemi di seluruh dunia byk pabrik stop krna lockdown kmudian pabrik di china di landa banjir namun rata smua pabruk sudah produksi normal jika di katakan hrga bahan baku cntoh utk pupuk npk dan urea yg bahan bakuny gas byk di dlm negeri bs dcek hrga gas tiap tahun di indo jd ini lebih di picu krna oligarki melihat petani sawit tengah mendapatkn keuntungan besar dgn hrga tbs yg naik jadi mereka ikut menaikkn hrga pupuk lebih dr bahkan hrga herbisida meroket,0,2022-01-24T07:01:49Z,pemupukan,2022,sebenarny ini cm ulah oligarki pada awalnya memang krna pandemi di seluruh dunia byk pabrik stop krna lockdown kmudian pabrik di china di landa banjir namun rata smua pabruk sudah produksi normal jika di katakan hrga bahan baku cntoh utk pupuk npk dan urea yg bahan bakuny gas byk di dlm negeri bs dcek hrga gas tiap tahun di indo jd ini lebih di picu krna oligarki melihat petani sawit tengah mendapatkn keuntungan besar dgn hrga tbs yg naik jadi mereka ikut menaikkn hrga pupuk lebih dr bahkan hrga herbisida meroket,"sebenarny, ini, cm, ulah, oligarki, pada, awalnya, memang, krna, pandemi, di, seluruh, dunia, byk, pabrik, stop, krna, lockdown, kmudian, pabrik, di, china, di, landa, banjir, namun, rata, smua, pabruk, sudah, produksi, normal, jika, di, katakan, hrga, bahan, baku, cntoh, utk, pupuk, npk, dan, urea, yg, bahan, bakuny, gas, byk, di, dlm, negeri, bs, dcek, hrga, gas, tiap, tahun, di, indo, jd, ini, lebih, di, picu, krna, oligarki, melihat, petani, sawit, tengah, mendapatkn, keuntungan, besar, dgn, hrga, tbs, yg, naik, jadi, mereka, ikut, menaikkn, hrga, pupuk, lebih, dr, bahkan, hrga, herbisida, meroket","sebenarny, cm, ulah, oligarki, krna, pandemi, dunia, byk, pabrik, stop, krna, lockdown, kmudian, pabrik, china, landa, banjir, smua, pabruk, produksi, normal, hrga, bahan, baku, cntoh, utk, pupuk, npk, urea, yg, bahan, bakuny, gas, byk, dlm, negeri, bs, dcek, hrga, gas, indo, jd, picu, krna, oligarki, petani, sawit, mendapatkn, keuntungan, dgn, hrga, tbs, yg, menaikkn, hrga, pupuk, dr, hrga, herbisida, meroket","sebenarny, cm, ulah, oligarki, krna, pandemi, dunia, byk, pabrik, stop, krna, lockdown, kmudian, pabrik, china, landa, banjir, smua, pabruk, produksi, normal, hrga, bahan, baku, cntoh, utk, pupuk, npk, urea, yg, bahan, bakuny, gas, byk, dlm, negeri, bs, dcek, hrga, gas, indo, jd, picu, krna, oligarki, tani, sawit, mendapatkn, untung, dgn, hrga, tbs, yg, menaikkn, hrga, pupuk, dr, hrga, herbisida, roket","dosis dan waktu pupuk, konflik pupuk kimia organik"
UfbQxFXre5Q,@agusfalen7241,gillak harga pupuk dan obat gulma naeknya urea aja yang subsidi sekarang per sak di tempat saya langka pula,0,2022-01-20T17:21:48Z,pemupukan,2022,gillak harga pupuk dan obat gulma naeknya urea aja yang subsidi sekarang per sak di tempat saya langka pula,"gillak, harga, pupuk, dan, obat, gulma, naeknya, urea, aja, yang, subsidi, sekarang, per, sak, di, tempat, saya, langka, pula","gillak, harga, pupuk, obat, gulma, naeknya, urea, aja, subsidi, sak, langka","gillak, harga, pupuk, obat, gulma, naek, urea, aja, subsidi, sak, langka","dosis dan waktu pupuk, konflik pupuk kimia organik"
UfbQxFXre5Q,@muminmumin7288,utk hrg pupuk jt ktl tdk masala yg penting harga gaba sama dng satukintal pupuk urea jadi pemerintah mau tdk utk melakukannya,0,2022-01-20T13:47:26Z,pemupukan,2022,utk hrg pupuk jt ktl tdk masala yg penting harga gaba sama dng satukintal pupuk urea jadi pemerintah mau tdk utk melakukannya,"utk, hrg, pupuk, jt, ktl, tdk, masala, yg, penting, harga, gaba, sama, dng, satukintal, pupuk, urea, jadi, pemerintah, mau, tdk, utk, melakukannya","utk, hrg, pupuk, jt, ktl, tdk, masala, yg, harga, gaba, dng, satukintal, pupuk, urea, pemerintah, tdk, utk, melakukannya","utk, hrg, pupuk, jt, ktl, tdk, masala, yg, harga, gaba, dng, satukintal, pupuk, urea, perintah, tdk, utk, laku","dosis dan waktu pupuk, konflik pupuk kimia organik"
UfbQxFXre5Q,@alifrizqi8173,makanya sebagai petani cerdas kita buat pupuk sendiri yaitu pupuk alami kompos dan kohe hewan apalagi sekarang ada jakaba,0,2022-01-20T09:49:28Z,pemupukan,2022,makanya sebagai petani cerdas kita buat pupuk sendiri yaitu pupuk alami kompos dan kohe hewan apalagi sekarang ada jakaba,"makanya, sebagai, petani, cerdas, kita, buat, pupuk, sendiri, yaitu, pupuk, alami, kompos, dan, kohe, hewan, apalagi, sekarang, ada, jakaba","petani, cerdas, pupuk, pupuk, alami, kompos, kohe, hewan, jakaba","tani, cerdas, pupuk, pupuk, alami, kompos, kohe, hewan, jakaba","dosis dan waktu pupuk, konflik pupuk kimia organik"
UfbQxFXre5Q,@ahmadkalbar8784,urea subsidi sekarang jadi bisnis yang punya kartu tani yg kuotanya dapat banyak misal urea ribu per sak dijual ke rekan tani lain yg tidak punya kartu,0,2022-01-20T00:17:13Z,pemupukan,2022,urea subsidi sekarang jadi bisnis yang punya kartu tani yg kuotanya dapat banyak misal urea ribu per sak dijual ke rekan tani lain yg tidak punya kartu,"urea, subsidi, sekarang, jadi, bisnis, yang, punya, kartu, tani, yg, kuotanya, dapat, banyak, misal, urea, ribu, per, sak, dijual, ke, rekan, tani, lain, yg, tidak, punya, kartu","urea, subsidi, bisnis, kartu, tani, yg, kuotanya, urea, ribu, sak, dijual, rekan, tani, yg, kartu","urea, subsidi, bisnis, kartu, tani, yg, kuota, urea, ribu, sak, jual, rekan, tani, yg, kartu",konflik pupuk kimia organik
UfbQxFXre5Q,@gin_dopas1610,perlu diselidiki juga apakah ada praktik monopoli oleh importir pupuk kimia karena permintaan yg sangat tinggi oleh perkebunan sawit,0,2022-01-19T10:39:33Z,pemupukan,2022,perlu diselidiki juga apakah ada praktik monopoli oleh importir pupuk kimia karena permintaan yg sangat tinggi oleh perkebunan sawit,"perlu, diselidiki, juga, apakah, ada, praktik, monopoli, oleh, importir, pupuk, kimia, karena, permintaan, yg, sangat, tinggi, oleh, perkebunan, sawit","diselidiki, praktik, monopoli, importir, pupuk, kimia, permintaan, yg, perkebunan, sawit","selidik, praktik, monopoli, importir, pupuk, kimia, minta, yg, kebun, sawit","dosis dan waktu pupuk, konflik pupuk kimia organik"
UfbQxFXre5Q,@jurnalsirait7639,cara untuk menjatuhkan harga pupuk kimia hanya satu solusinya mari kita pakai organik diatas dikatan sayur mayur bukan komuditas anak tiri,0,2022-01-18T23:24:04Z,pemupukan,2022,cara untuk menjatuhkan harga pupuk kimia hanya satu solusinya mari kita pakai organik diatas dikatan sayur mayur bukan komuditas anak tiri,"cara, untuk, menjatuhkan, harga, pupuk, kimia, hanya, satu, solusinya, mari, kita, pakai, organik, diatas, dikatan, sayur, mayur, bukan, komuditas, anak, tiri","menjatuhkan, harga, pupuk, kimia, solusinya, mari, pakai, organik, diatas, dikatan, sayur, mayur, komuditas, anak, tiri","jatuh, harga, pupuk, kimia, solusi, mari, pakai, organik, atas, katan, sayur, mayur, komuditas, anak, tiri","dosis dan waktu pupuk, konflik pupuk kimia organik"
UfbQxFXre5Q,@satriasaja5309,sahabat tani kita harus blajar tidak pusing kita coba belajar ke organik bikin sendiri kita coba hilangkan kimiya yg biasa kita pake kalau kita tetap mengandalkan kimia kita petani kupastikan akan gulung tikar alias wasalamm,0,2022-01-18T16:52:55Z,pemupukan,2022,sahabat tani kita harus blajar tidak pusing kita coba belajar ke organik bikin sendiri kita coba hilangkan kimiya yg biasa kita pake kalau kita tetap mengandalkan kimia kita petani kupastikan akan gulung tikar alias wasalamm,"sahabat, tani, kita, harus, blajar, tidak, pusing, kita, coba, belajar, ke, organik, bikin, sendiri, kita, coba, hilangkan, kimiya, yg, biasa, kita, pake, kalau, kita, tetap, mengandalkan, kimia, kita, petani, kupastikan, akan, gulung, tikar, alias, wasalamm","sahabat, tani, blajar, pusing, coba, belajar, organik, bikin, coba, hilangkan, kimiya, yg, pake, mengandalkan, kimia, petani, kupastikan, gulung, tikar, alias, wasalamm","sahabat, tani, blajar, pusing, coba, ajar, organik, bikin, coba, hilang, kimiya, yg, pake, andal, kimia, tani, pasti, gulung, tikar, alias, wasalamm",konflik pupuk kimia organik
UfbQxFXre5Q,@kurochanel9491,mentripertanian ayo dong pak bantu dan dukung pengembangan pertanian organik buat kan program disetiap daerah agar petani lebih mandiri,2,2022-01-17T23:59:40Z,pemupukan,2022,mentripertanian ayo dong pak bantu dan dukung pengembangan pertanian organik buat kan program disetiap daerah agar petani lebih mandiri,"mentripertanian, ayo, dong, pak, bantu, dan, dukung, pengembangan, pertanian, organik, buat, kan, program, disetiap, daerah, agar, petani, lebih, mandiri","mentripertanian, ayo, bantu, dukung, pengembangan, pertanian, organik, program, disetiap, daerah, petani, mandiri","mentripertanian, ayo, bantu, dukung, kembang, tani, organik, program, tiap, daerah, tani, mandiri",konflik pupuk kimia organik
UfbQxFXre5Q,@bangdardi8193,bikin pupuk alami aj mass dari koman juga subur nyuburrrr gak kalah dgn pupuk kimia,1,2022-01-17T21:22:02Z,pemupukan,2022,bikin pupuk alami aj mass dari koman juga subur nyuburrrr gak kalah dgn pupuk kimia,"bikin, pupuk, alami, aj, mass, dari, koman, juga, subur, nyuburrrr, gak, kalah, dgn, pupuk, kimia","bikin, pupuk, alami, aj, mass, koman, subur, nyuburrrr, gak, kalah, dgn, pupuk, kimia","bikin, pupuk, alami, aj, mass, koman, subur, nyuburrrr, gak, kalah, dgn, pupuk, kimia","dampak pupuk ke tanaman, dosis dan waktu pupuk, konflik pupuk kimia organik"
UfbQxFXre5Q,@ademuhara6733,pak mending sosialisasikan penggunaan pupuk organik yg dapat di bikin sendiri dibandingkan mempromosikan menjelaskan pupuk kimia yg merusak tanah mengakibatkan tanah semakin rusak sehingga petani semakin lama pasti menambah dosis pupuk kimia dan akhirnya petani sakau pupuk kimia terimakasih semoga bisa dipertimbangkan semoga pentani makin jaya,2,2022-01-17T15:40:10Z,pemupukan,2022,pak mending sosialisasikan penggunaan pupuk organik yg dapat di bikin sendiri dibandingkan mempromosikan menjelaskan pupuk kimia yg merusak tanah mengakibatkan tanah semakin rusak sehingga petani semakin lama pasti menambah dosis pupuk kimia dan akhirnya petani sakau pupuk kimia terimakasih semoga bisa dipertimbangkan semoga pentani makin jaya,"pak, mending, sosialisasikan, penggunaan, pupuk, organik, yg, dapat, di, bikin, sendiri, dibandingkan, mempromosikan, menjelaskan, pupuk, kimia, yg, merusak, tanah, mengakibatkan, tanah, semakin, rusak, sehingga, petani, semakin, lama, pasti, menambah, dosis, pupuk, kimia, dan, akhirnya, petani, sakau, pupuk, kimia, terimakasih, semoga, bisa, dipertimbangkan, semoga, pentani, makin, jaya","mending, sosialisasikan, penggunaan, pupuk, organik, yg, bikin, dibandingkan, mempromosikan, pupuk, kimia, yg, merusak, tanah, mengakibatkan, tanah, rusak, petani, menambah, dosis, pupuk, kimia, petani, sakau, pupuk, kimia, terimakasih, semoga, dipertimbangkan, semoga, pentani, jaya","mending, sosialisasi, guna, pupuk, organik, yg, bikin, banding, promosi, pupuk, kimia, yg, rusak, tanah, akibat, tanah, rusak, tani, tambah, dosis, pupuk, kimia, tani, sakau, pupuk, kimia, terimakasih, moga, timbang, moga, pentan, jaya","dosis dan waktu pupuk, konflik pupuk kimia organik"
UfbQxFXre5Q,@MB-nh1mq,mari beralih ke organik mungkin saat ini memang berat tapi ketika suatu saat pertanian organik sudah manjadi prioritas yg lain masih belajar kita sudah memahaminya,1,2022-01-17T12:45:22Z,pemupukan,2022,mari beralih ke organik mungkin saat ini memang berat tapi ketika suatu saat pertanian organik sudah manjadi prioritas yg lain masih belajar kita sudah memahaminya,"mari, beralih, ke, organik, mungkin, saat, ini, memang, berat, tapi, ketika, suatu, saat, pertanian, organik, sudah, manjadi, prioritas, yg, lain, masih, belajar, kita, sudah, memahaminya","mari, beralih, organik, berat, pertanian, organik, manjadi, prioritas, yg, belajar, memahaminya","mari, alih, organik, berat, tani, organik, manjadi, prioritas, yg, ajar, paham",konflik pupuk kimia organik
UfbQxFXre5Q,@juwariclothing8651,npk profesional kg,0,2022-01-17T04:06:04Z,pemupukan,2022,npk profesional kg,"npk, profesional, kg","npk, profesional, kg","npk, profesional, kg",konflik pupuk kimia organik
UfbQxFXre5Q,@zulvansetiawan6562,indikator yg disampaikan rasional dan masuk akal bahkan berbasis data keren namun perlu di ingat pelepasan lahan secara masif itu didasari oleh biaya perawatan mahal dari persiapan lahan hingga panen herbisida pestisida dan pupuk harga jual komoditi petani murah sekaligus stagnan terbatasanya ruang dalam memasarkan hasil komoditi alhasil mereka yg mengelola lahan hanya mereka yg mampu membuat herbisidanya sendiri pupuknya sendiri insectisidanya sendiri serta marketnya sendiri jaga tanah kita salam organik,1,2022-01-16T23:18:26Z,pemupukan,2022,indikator yg disampaikan rasional dan masuk akal bahkan berbasis data keren namun perlu di ingat pelepasan lahan secara masif itu didasari oleh biaya perawatan mahal dari persiapan lahan hingga panen herbisida pestisida dan pupuk harga jual komoditi petani murah sekaligus stagnan terbatasanya ruang dalam memasarkan hasil komoditi alhasil mereka yg mengelola lahan hanya mereka yg mampu membuat herbisidanya sendiri pupuknya sendiri insectisidanya sendiri serta marketnya sendiri jaga tanah kita salam organik,"indikator, yg, disampaikan, rasional, dan, masuk, akal, bahkan, berbasis, data, keren, namun, perlu, di, ingat, pelepasan, lahan, secara, masif, itu, didasari, oleh, biaya, perawatan, mahal, dari, persiapan, lahan, hingga, panen, herbisida, pestisida, dan, pupuk, harga, jual, komoditi, petani, murah, sekaligus, stagnan, terbatasanya, ruang, dalam, memasarkan, hasil, komoditi, alhasil, mereka, yg, mengelola, lahan, hanya, mereka, yg, mampu, membuat, herbisidanya, sendiri, pupuknya, sendiri, insectisidanya, sendiri, serta, marketnya, sendiri, jaga, tanah, kita, salam, organik","indikator, yg, rasional, masuk, akal, berbasis, data, keren, pelepasan, lahan, masif, didasari, biaya, perawatan, mahal, persiapan, lahan, panen, herbisida, pestisida, pupuk, harga, jual, komoditi, petani, murah, stagnan, terbatasanya, ruang, memasarkan, hasil, komoditi, alhasil, yg, mengelola, lahan, yg, herbisidanya, pupuknya, insectisidanya, marketnya, jaga, tanah, salam, organik","indikator, yg, rasional, masuk, akal, bas, data, ren, lepas, lahan, masif, dasar, biaya, awat, mahal, siap, lahan, panen, herbisida, pestisida, pupuk, harga, jual, komoditi, tani, murah, stagnan, terbatasa, ruang, pasar, hasil, komoditi, alhasil, yg, elola, lahan, yg, herbisida, pupuk, insectisida, market, jaga, tanah, salam, organik","dosis dan waktu pupuk, efisiensi penggunaan pupuk, konflik pupuk kimia organik"
UfbQxFXre5Q,@mrbejo423,semakin mahal pupukny semakin cepat gulung tikar pabriknya karna petani gx sanggup membeli pupuk gak seimbang dengan hasil panen otomatis pupuk kandang jd pilihan dan nyatanya pun bisa bagus pakai pupuk kandang ampun om pupuk harga nya sekrg bukan maenn beliin pupuk kandang dapet sak truck,0,2022-01-16T15:12:53Z,pemupukan,2022,semakin mahal pupukny semakin cepat gulung tikar pabriknya karna petani gx sanggup membeli pupuk gak seimbang dengan hasil panen otomatis pupuk kandang jd pilihan dan nyatanya pun bisa bagus pakai pupuk kandang ampun om pupuk harga nya sekrg bukan maenn beliin pupuk kandang dapet sak truck,"semakin, mahal, pupukny, semakin, cepat, gulung, tikar, pabriknya, karna, petani, gx, sanggup, membeli, pupuk, gak, seimbang, dengan, hasil, panen, otomatis, pupuk, kandang, jd, pilihan, dan, nyatanya, pun, bisa, bagus, pakai, pupuk, kandang, ampun, om, pupuk, harga, nya, sekrg, bukan, maenn, beliin, pupuk, kandang, dapet, sak, truck","mahal, pupukny, cepat, gulung, tikar, pabriknya, karna, petani, gx, sanggup, membeli, pupuk, gak, seimbang, hasil, panen, otomatis, pupuk, kandang, jd, pilihan, bagus, pakai, pupuk, kandang, ampun, om, pupuk, harga, nya, sekrg, maenn, beliin, pupuk, kandang, dapet, sak, truck","mahal, pupukny, cepat, gulung, tikar, pabrik, karna, tani, gx, sanggup, beli, pupuk, gak, imbang, hasil, panen, otomatis, pupuk, kandang, jd, pilih, bagus, pakai, pupuk, kandang, ampun, om, pupuk, harga, , sekrg, maenn, beliin, pupuk, kandang, dapet, sak, truck","dosis dan waktu pupuk, efisiensi penggunaan pupuk, konflik pupuk kimia organik"
UfbQxFXre5Q,@andromax4606,seharusnya petani indonesia sudah tinggalkan pupuk dan obat an kimia melihat dampak kesehatan manusia dan rusaknya alam coba pemerintah serius untuk go organik harus bisa dengan semangat membangun kehidupan yang lebih baik,1,2022-01-16T14:57:57Z,pemupukan,2022,seharusnya petani indonesia sudah tinggalkan pupuk dan obat an kimia melihat dampak kesehatan manusia dan rusaknya alam coba pemerintah serius untuk go organik harus bisa dengan semangat membangun kehidupan yang lebih baik,"seharusnya, petani, indonesia, sudah, tinggalkan, pupuk, dan, obat, an, kimia, melihat, dampak, kesehatan, manusia, dan, rusaknya, alam, coba, pemerintah, serius, untuk, go, organik, harus, bisa, dengan, semangat, membangun, kehidupan, yang, lebih, baik","petani, indonesia, tinggalkan, pupuk, obat, an, kimia, dampak, kesehatan, manusia, rusaknya, alam, coba, pemerintah, serius, go, organik, semangat, membangun, kehidupan","tani, indonesia, tinggal, pupuk, obat, an, kimia, dampak, sehat, manusia, rusak, alam, coba, perintah, serius, go, organik, semangat, bangun, hidup","dosis dan waktu pupuk, konflik pupuk kimia organik"
UfbQxFXre5Q,@mangkarangofficial9924,petani bisa bertani tanpa pupuk kimia tp apakah pedagang pupuk bisa jualan tanpa petani cobak resapkan,0,2022-01-16T08:31:43Z,pemupukan,2022,petani bisa bertani tanpa pupuk kimia tp apakah pedagang pupuk bisa jualan tanpa petani cobak resapkan,"petani, bisa, bertani, tanpa, pupuk, kimia, tp, apakah, pedagang, pupuk, bisa, jualan, tanpa, petani, cobak, resapkan","petani, bertani, pupuk, kimia, tp, pedagang, pupuk, jualan, petani, cobak, resapkan","tani, tan, pupuk, kimia, tp, dagang, pupuk, jual, tani, cobak, resap","dosis dan waktu pupuk, konflik pupuk kimia organik"
UfbQxFXre5Q,@PetaniGenerasiMilenial,di daerah saya sulawesi tengah harga pupuk npk tahun yang lalu harga kemasan kg ribu barusan beli npk harganya ribu kenaikan harga sangat drastis sesuai dengan hukum ekonomi apakah pupuk dari mtj akan terus meningkat harganya semoga ada solusi bagi para petani agar keseimbangan harga pupuk sesuai dengan hasil yang di peroleh para petani,0,2022-01-15T15:46:20Z,pemupukan,2022,di daerah saya sulawesi tengah harga pupuk npk tahun yang lalu harga kemasan kg ribu barusan beli npk harganya ribu kenaikan harga sangat drastis sesuai dengan hukum ekonomi apakah pupuk dari mtj akan terus meningkat harganya semoga ada solusi bagi para petani agar keseimbangan harga pupuk sesuai dengan hasil yang di peroleh para petani,"di, daerah, saya, sulawesi, tengah, harga, pupuk, npk, tahun, yang, lalu, harga, kemasan, kg, ribu, barusan, beli, npk, harganya, ribu, kenaikan, harga, sangat, drastis, sesuai, dengan, hukum, ekonomi, apakah, pupuk, dari, mtj, akan, terus, meningkat, harganya, semoga, ada, solusi, bagi, para, petani, agar, keseimbangan, harga, pupuk, sesuai, dengan, hasil, yang, di, peroleh, para, petani","daerah, sulawesi, harga, pupuk, npk, harga, kemasan, kg, ribu, barusan, beli, npk, harganya, ribu, kenaikan, harga, drastis, sesuai, hukum, ekonomi, pupuk, mtj, meningkat, harganya, semoga, solusi, petani, keseimbangan, harga, pupuk, sesuai, hasil, peroleh, petani","daerah, sulawesi, harga, pupuk, npk, harga, mas, kg, ribu, barusan, beli, npk, harga, ribu, naik, harga, drastis, sesuai, hukum, ekonomi, pupuk, mtj, tingkat, harga, moga, solusi, tani, imbang, harga, pupuk, sesuai, hasil, oleh, tani","dosis dan waktu pupuk, konflik pupuk kimia organik"
UfbQxFXre5Q,@wongkebumen7893,matur nuwun mas infone alhamdulillah didesa saya hampir semua masih pakai pupuk kandang jd gk terlalu pengaruh ama kenaikan pupuk atau pun penurunan harga karena seenggaknya pengeluaran untuk modal sngt berkurang sehat selalu untuk semua dan semoga tambah sukses,0,2022-01-15T14:16:05Z,pemupukan,2022,matur nuwun mas infone alhamdulillah didesa saya hampir semua masih pakai pupuk kandang jd gk terlalu pengaruh ama kenaikan pupuk atau pun penurunan harga karena seenggaknya pengeluaran untuk modal sngt berkurang sehat selalu untuk semua dan semoga tambah sukses,"matur, nuwun, mas, infone, alhamdulillah, didesa, saya, hampir, semua, masih, pakai, pupuk, kandang, jd, gk, terlalu, pengaruh, ama, kenaikan, pupuk, atau, pun, penurunan, harga, karena, seenggaknya, pengeluaran, untuk, modal, sngt, berkurang, sehat, selalu, untuk, semua, dan, semoga, tambah, sukses","matur, nuwun, mas, infone, alhamdulillah, didesa, pakai, pupuk, kandang, jd, gk, pengaruh, ama, kenaikan, pupuk, penurunan, harga, seenggaknya, pengeluaran, modal, sngt, berkurang, sehat, semoga, sukses","matur, nuwun, mas, infone, alhamdulillah, desa, pakai, pupuk, kandang, jd, gk, pengaruh, ama, naik, pupuk, turun, harga, enggak, keluar, modal, sngt, kurang, sehat, moga, sukses","dosis dan waktu pupuk, konflik pupuk kimia organik"
